{
  "url": "https://example.com",
  "success": true,
  "title": "Example Domain",
  "content": "This domain is for use in illustrative examples in documents. You may use this domain in literature without prior coordination or asking for permission.",
  "metadata": {
    "status_code": 200,
    "content_type": "text/html",
    "extracted_text": true
  }
}
